{"version":3,"id":"placement","fields":[{"name":"first","kind":"text"},{"name":"last","kind":"text"},{"name":"street","kind":"text"},{"name":"city","kind":"text"},{"name":"notes","kind":"textarea"}],"layout":[{"kind":"columns","id":"name","columns":[["first"],[{"ref":"last","at":{"base":{"hidden":true},"md":{"column":2,"hidden":false}}}]],"at":{"sm":2}},{"kind":"columns","id":"body","columns":[[{"kind":"section","id":"address","label":"Address","children":["street","city"],"at":{"base":{"hidden":true}}}],["notes"]]}]}
